{
	"$schema": "https://exhuma.dev/schema/registry-index.json",
	"version": "1.0.0",
	"generatedAt": "2026-09-28T14:52:41.739Z",
	"categories": [
		{ "id": "cards", "label": "Tactile Cards & Interactions", "count": 8 },
		{ "id": "layouts", "label": "Responsive Layout Engines", "count": 5 },
		{ "id": "navigation", "label": "Navigation & Rails", "count": 2 },
		{ "id": "primitives", "label": "Kinetic Primitives & Disclosures", "count": 4 }
	],
	"components": [
		{
			"name": "Stacking Cards",
			"slug": "stacking-cards",
			"category": "cards",
			"description": "Layered 3D sticky stack cards with progressive scroll depth scale decay and reverse scaling exit mechanics.",
			"version": "1.0.0",
			"props": [
				{ "name": "topStart", "label": "Top Start (px)", "type": "number", "defaultValue": 20, "min": 0, "max": 200, "step": 4, "description": "Offset in pixels from top of viewport for the first sticky card." },
				{
					"name": "topIncrement",
					"label": "Top Increment (px)",
					"type": "number",
					"defaultValue": 28,
					"min": 8,
					"max": 64,
					"step": 4,
					"description": "Vertical stacking offset in pixels for each subsequent card."
				},
				{
					"name": "cardGap",
					"label": "Card Gap (px)",
					"type": "number",
					"defaultValue": 20,
					"min": 0,
					"max": 160,
					"step": 4,
					"description": "Vertical gap in pixels between cards in normal flow before they stack."
				},
				{
					"name": "scaleThreshold",
					"label": "Scale Threshold (px)",
					"type": "number",
					"defaultValue": 150,
					"min": 50,
					"max": 400,
					"step": 10,
					"description": "Scroll distance threshold over which progressive scaling activates."
				},
				{ "name": "minScale", "label": "Minimum Scale", "type": "number", "defaultValue": 0.9, "min": 0.75, "max": 0.99, "step": 0.01, "description": "Minimum scale applied to the base card in the stack." },
				{ "name": "reverseScale", "label": "Reverse Scale", "type": "boolean", "defaultValue": true, "description": "Enable or disable reverse scaling exit cascade mechanics." }
			],
			"dependencies": {
				"react": ["@exhuma/core"],
				"nextjs": ["@exhuma/core"],
				"vue": [],
				"svelte": [],
				"solid": [],
				"angular": [],
				"astro": [],
				"blade": [],
				"vanilla": [],
				"wordpress": [],
				"webcomponent": [],
				"react-native": [],
				"flutter": []
			},
			"flavors": ["react", "nextjs", "vue", "svelte", "angular", "solid", "astro", "blade", "vanilla", "wordpress", "webcomponent", "react-native", "flutter"]
		},
		{
			"name": "Horizontal Scroller",
			"slug": "horizontal-scroller",
			"category": "cards",
			"description": "Pinned kinetic viewport camera that seamlessly translates horizontal cards in 1:1 synchronization with vertical page scroll (Brix Agency architecture).",
			"version": "1.1.0",
			"props": [
				{ "name": "itemGap", "label": "Card Gap (px)", "type": "number", "defaultValue": 28, "min": 8, "max": 64, "step": 4, "description": "Spacing in pixels between horizontal cards (default: 28px)." },
				{
					"name": "speed",
					"label": "Scroll Speed Multiplier",
					"type": "number",
					"defaultValue": 1,
					"min": 0.2,
					"max": 2.5,
					"step": 0.05,
					"description": "Scroll distance multiplier mapping vertical page scroll to horizontal translation distance."
				},
				{ "name": "cardWidth", "label": "Card Width (px)", "type": "number", "defaultValue": 320, "min": 240, "max": 600, "step": 10, "description": "Fixed card width in pixels (default: 320px)." },
				{ "name": "showProgress", "label": "Progress Indicator", "type": "boolean", "defaultValue": true, "description": "Display a kinetic telemetry progress bar indicating track traversal percentage." },
				{ "name": "showFadeEdges", "label": "Fade Edges", "type": "boolean", "defaultValue": true, "description": "Show subtle gradient mask at horizontal boundaries for graceful card entry and exit." },
				{ "name": "fadeWidth", "label": "Fade Width (px)", "type": "number", "defaultValue": 48, "min": 16, "max": 96, "step": 8, "description": "Width in pixels of the left and right gradient fade masks." },
				{ "name": "fadeEdgeColor", "label": "Fade Edge Color", "type": "color", "defaultValue": "#ffffff", "description": "Custom edge gradient color. When empty, an alpha mask is used." },
				{
					"name": "fadeEdgeColorDark",
					"label": "Fade Edge Color (Dark Mode)",
					"type": "color",
					"defaultValue": "#09090b",
					"description": "Edge gradient color when dark mode is active. Falls back to fadeEdgeColor."
				},
				{
					"name": "mobileMode",
					"label": "Mobile Mode",
					"type": "select",
					"defaultValue": "scroll",
					"options": [
						{ "label": "Touch Swipe & Snap (scroll)", "value": "scroll" },
						{ "label": "Vertical Stack Deck (stack)", "value": "stack" },
						{ "label": "Pinned Kinetic Rail (pinned)", "value": "pinned" }
					],
					"description": "Mobile fallback behavior below 768px (scroll = native touch swipe with snap, stack = vertical list, pinned = retain pinned rail)."
				}
			],
			"dependencies": {
				"react": ["@exhuma/core"],
				"nextjs": ["@exhuma/core"],
				"vue": [],
				"svelte": [],
				"solid": [],
				"angular": [],
				"astro": [],
				"blade": [],
				"vanilla": [],
				"wordpress": [],
				"webcomponent": [],
				"react-native": [],
				"flutter": []
			},
			"flavors": ["react", "nextjs", "vue", "svelte", "angular", "solid", "astro", "blade", "vanilla", "wordpress", "webcomponent", "react-native", "flutter"]
		},
		{
			"name": "CSS Masonry",
			"slug": "css-masonry",
			"category": "layouts",
			"description": "Pure CSS multi-column responsive masonry layout with zero external JavaScript runtime overhead.",
			"version": "1.0.0",
			"props": [
				{ "name": "columns", "label": "Mobile Columns (<640px)", "type": "number", "defaultValue": 1, "min": 1, "max": 8, "step": 1, "description": "Base column count on mobile viewports (<640px)." },
				{ "name": "columnsSm", "label": "Tablet Columns (640-1024px)", "type": "number", "defaultValue": 2, "min": 1, "max": 4, "step": 1, "description": "Number of columns on tablet viewports (≥640px)." },
				{ "name": "columnsMd", "label": "Medium Tablet Columns", "type": "number", "defaultValue": 2, "min": 1, "max": 6, "step": 1, "description": "Number of columns on medium tablet viewports." },
				{ "name": "columnsLg", "label": "Desktop Columns (1024-1280px)", "type": "number", "defaultValue": 3, "min": 1, "max": 8, "step": 1, "description": "Number of columns on desktop viewports." },
				{ "name": "columnsXl", "label": "Ultra-wide Columns (≥1280px)", "type": "number", "defaultValue": 4, "min": 1, "max": 10, "step": 1, "description": "Number of columns on large screens (≥1280px)." },
				{ "name": "gap", "label": "Gap (px)", "type": "number", "defaultValue": 16, "min": 4, "max": 64, "step": 4, "description": "Spacing between masonry columns and item margins." },
				{
					"name": "columnFill",
					"label": "Column Fill",
					"type": "select",
					"defaultValue": "balance",
					"options": [
						{ "label": "Balance (Balanced Heights)", "value": "balance" },
						{ "label": "Auto (Sequential Waterfall)", "value": "auto" }
					],
					"description": "Controls whether column heights are balanced or filled sequentially."
				},
				{
					"name": "height",
					"label": "Container Height (px)",
					"type": "number",
					"defaultValue": 0,
					"min": 0,
					"max": 1200,
					"step": 20,
					"description": "Explicit container height for sequential waterfall (0 for auto balance)."
				}
			],
			"dependencies": {
				"react": ["@exhuma/core"],
				"nextjs": ["@exhuma/core"],
				"vue": ["clsx"],
				"svelte": ["clsx"],
				"solid": ["clsx"],
				"angular": [],
				"astro": [],
				"blade": [],
				"vanilla": [],
				"wordpress": [],
				"webcomponent": [],
				"react-native": [],
				"flutter": []
			},
			"flavors": ["react", "nextjs", "vue", "svelte", "angular", "solid", "astro", "blade", "vanilla", "wordpress", "webcomponent", "react-native", "flutter"]
		},
		{
			"name": "Auto Grid",
			"slug": "auto-grid",
			"category": "layouts",
			"description": "Responsive CSS Grid with auto-fit / auto-fill minmax repeat tracks with zero media queries.",
			"version": "1.0.0",
			"props": [
				{
					"name": "minItemWidth",
					"label": "Min Width (px)",
					"type": "number",
					"defaultValue": 280,
					"min": 120,
					"max": 480,
					"step": 10,
					"description": "Minimum width of each grid column before wrapping to the next line."
				},
				{ "name": "gap", "label": "Grid Gap (px)", "type": "number", "defaultValue": 24, "min": 4, "max": 64, "step": 4, "description": "Gap between grid items." },
				{
					"name": "mode",
					"label": "Track Mode",
					"type": "select",
					"defaultValue": "auto-fit",
					"options": [
						{ "label": "Auto-Fit (Expand to Fill Row)", "value": "auto-fit" },
						{ "label": "Auto-Fill (Preserve Track Widths)", "value": "auto-fill" }
					],
					"description": "Determines whether tracks collapse to stretch items or stay fixed."
				},
				{ "name": "maxColumns", "label": "Max Columns", "type": "number", "defaultValue": 4, "min": 1, "max": 12, "step": 1, "description": "Upper constraint on maximum columns allowed." },
				{
					"name": "alignItems",
					"label": "Item Alignment",
					"type": "select",
					"defaultValue": "stretch",
					"options": [
						{ "label": "Stretch (Equal Height)", "value": "stretch" },
						{ "label": "Start (Top)", "value": "start" },
						{ "label": "Center (Middle)", "value": "center" },
						{ "label": "End (Bottom)", "value": "end" }
					],
					"description": "Cross-axis vertical alignment for items within grid rows."
				}
			],
			"dependencies": {
				"react": ["@exhuma/core"],
				"nextjs": ["@exhuma/core"],
				"vue": ["clsx"],
				"svelte": ["clsx"],
				"solid": ["clsx"],
				"angular": [],
				"astro": [],
				"blade": [],
				"vanilla": [],